{"alignment":"UTC","availability_model":"historical_close_assumption","candles":[{"byte_hash":"sha256:72d78b744fafc48098736d16e35c1ce9657e4c72201e3a2eef479c81b3472bd2","duplicate_ranges":[],"end":"2026-10-20T00:00:00Z","finalized_rows":528,"logical_hash":"sha256:e98529572f78b8892f9922a2fd0a357e452702a2fee3275a82694f93925a9198","missing_ranges":[],"path":"candles.parquet","rows":528,"start":"2026-07-24T00:00:00Z","timeframe":"4h"}],"created_at":"2026-10-21T01:26:33.613639Z","dataset_id":"okx-public-btc-4h","dataset_version":"016599215bbf216d8ee965ae","funding":{"byte_hash":"sha256:39231a8ca38aaf3ee7c29584c540a4b0e6a2d571ec36e37f411e6c6758d8a4ed","end":"2026-10-20T00:00:00Z","interval_seconds":28800,"logical_hash":"sha256:8652f5131d01ade33f920f2b35f9a109875358fdf7e9237fca98b7bab8a4bfad","mode":"RECORDED","notional_basis":"ENTRY_FILL_PRICE_X_BASE_QUANTITY","path":"funding.parquet","rate_unit":"FRACTION_PER_EVENT","rows":264,"start":"2026-07-24T00:00:00Z"},"information_cutoff":"2026-10-21T01:26:33.613639Z","namespace":"LOCAL_RESEARCH","normalization_version":"r7-canonical-e1-v0.2","schema_version":"r7-dataset-v0.2","source_instrument":"BTC-USDT-SWAP","symbol":"BTC_USDT_PERP","units":{"instrument_type":"LINEAR_PERPETUAL","price":"USDT_PER_BASE","quantity":"BASE","settlement":"USDT","volume":"BASE"}}